{
  "version": 1,
  "source": {
    "repo_full_name": "QuietBriony/chill",
    "repo_url": "https://github.com/QuietBriony/chill",
    "owner": "QuietBriony",
    "default_branch": "main",
    "visibility": "public",
    "internal_or_external": "internal",
    "license": null,
    "inspected_at": "2026-05-10T00:00:00Z"
  },
  "classification": {
    "category": "ambient-surface",
    "current_role": "harvest-only",
    "target_repos": [
      "Music",
      "namima",
      "chill",
      "OpenClaw"
    ],
    "risk_level": "medium"
  },
  "evaluation": {
    "has_audio_files": false,
    "has_samples": false,
    "has_model_weights": false,
    "has_external_dependencies": true,
    "has_github_actions": false,
    "demo_available": true,
    "browser_compatible": true,
    "dependency_weight": "light",
    "maintenance_status": "active"
  },
  "harvest": {
    "useful_ideas": [
      "Quiet piano / trio listening surface",
      "Synthetic felt-like piano with long rests",
      "Touch / Phrase / Room as simple expressive controls",
      "Flow Director for settle, breathe, lift, decrescendo, and recover",
      "Quiet recovery rules and deterministic preview checks",
      "Local listening score habit",
      "Optional drum-floor soft pocket as manually-started trio support"
    ],
    "do_not_copy": [
      "Sample-based piano",
      "Copied artist phrases, songs, grooves, or motifs",
      "PULSE as the main identity",
      "BASS as a lead instrument",
      "Automatic drum-floor arming or Tone transport takeover",
      "Direct runtime code into Music engine"
    ],
    "production_translation": {
      "music": [
        "Use quiet piano / memory / soft-focus as a possible future named mode after creative review",
        "Translate Flow Director into long-form radio pacing and decrescendo behavior",
        "Recreate piano memory as production parameters or synth/pluck behavior, not samples"
      ],
      "namima": [
        "Borrow listening-safe pacing, quiet recovery, and simple controls only",
        "Keep chill piano/lofi/trio identity out of namima's default ambient lane"
      ],
      "chill": [
        "Keep as quiet piano / trio light surface and harvest source"
      ],
      "openclaw": [
        "Track as observe-first surface and human-gated continuation decision"
      ]
    },
    "recommended_next_pr": "docs: keep quiet piano / trio boundary current and request human taste review before any named Music mode"
  },
  "routing": {
    "music": {
      "enabled": true,
      "intent": "quiet piano / memory / soft-focus production translation"
    },
    "drum_floor": {
      "enabled": false,
      "intent": "no direct drum routing; optional soft pocket stays manually-started in chill"
    },
    "namima": {
      "enabled": true,
      "intent": "safe pacing and quiet recovery only"
    },
    "chill": {
      "enabled": true,
      "intent": "quiet piano / trio light surface continuation"
    },
    "openclaw": {
      "enabled": true,
      "intent": "observe-only card and human-gated continuation decision"
    }
  },
  "safety": {
    "metadata_only": true,
    "human_review_required": true,
    "no_direct_code_copy": true,
    "no_audio_import": true,
    "no_sample_import": true,
    "no_dependency_import": true,
    "no_workflow_change": true
  },
  "promotion": {
    "status": "review-only",
    "reviewer_notes": "Keep chill's quiet piano / trio identity separate unless a future human-reviewed Music mode decision approves adoption.",
    "rollback_plan": "Drop this sidecar or revert the future docs/runtime PR that consumes it."
  }
}
